2025-11-12_20-44-55 | Connecting to udp://:14540 …
2025-11-12_20-44-56 | Connected.
2025-11-12_20-44-56 | Arming…
2025-11-12_20-44-56 | Taking off…
2025-11-12_20-44-56 | Home: lat=47.3979711, lon=8.5462963, altMSL=0.2
2025-11-12_20-44-56 | Flight Altitude (MSL): 10.2 m
2025-11-12_20-45-06 | → GOTO WP1:محطة شحن 1 @ (47.3993635,8.5490434) yaw=53.2°
2025-11-12_20-59-40 | Connected
2025-11-12_20-59-40 | Arming…
2025-11-12_20-59-40 | Takeoff…
2025-11-12_21-00-49 | [ARRIVED] Holding 15s at محطة شحن 1
2025-11-12_21-02-22 | [ARRIVED] Holding 15s at محطة شحن 2
2025-11-12_21-02-51 | [ARRIVED] Holding 15s at محطة شحن 3
2025-11-12_21-06-09 | TIMEOUT REACHING TARGET
2025-11-12_21-06-12 | [ARRIVED] Holding 15s at محطة شحن 4
2025-11-12_21-09-31 | TIMEOUT REACHING TARGET
2025-11-12_23-02-53 | Connecting to udp://:14540 …
2025-11-12_23-02-54 | Connected.
2025-11-12_23-02-54 | Waiting for GPS & Home position…
2025-11-12_23-02-54 | GPS & Home position OK.
2025-11-12_23-02-54 | Home lat=47.3979712, lon=8.5460314, altMSL=0.7
2025-11-12_23-02-54 | Cruise Alt MSL = 25.7, Capture Alt MSL = 10.7
2025-11-12_23-02-54 | Arming…
2025-11-12_23-02-54 | Taking off…
2025-11-12_23-03-04 | WP1 محطة شحن 1: world(207.0,155.0) → rel(207.0,155.0) → gps(47.3993636,8.5487785)
2025-11-13_01-38-59 | Connecting to udp://:14540 …
2025-11-13_01-39-01 | Connected.
2025-11-13_01-39-01 | Waiting for GPS & Home position…
2025-11-13_01-39-04 | GPS & Home position OK.
2025-11-13_01-39-04 | Home lat=47.3979712, lon=8.5460312, altMSL=0.6
2025-11-13_01-39-04 | Cruise Alt MSL = 35.6, Capture Alt MSL = 15.6
2025-11-13_01-39-04 | Arming…
2025-11-13_01-39-04 | Taking off…
2025-11-13_01-39-14 | WP1 محطة شحن 1: world(207.0,155.0) → ENU(207.0,155.0) → gps(47.3993636,8.5487783)
2025-11-13_01-40-11 | [ARRIVED] Holding 15s at محطة شحن 1
2025-11-13_01-40-26 | Camera unknown error at محطة شحن 1: Camera.take_photo() missing 1 required positional argument: 'component_id'
2025-11-13_01-40-29 | WP2 محطة شحن 2: world(-132.2,99.5) → ENU(-132.2,99.5) → gps(47.3988653,8.5442764)
2025-11-13_01-41-42 | [ARRIVED] Holding 15s at محطة شحن 2
2025-11-13_01-41-57 | Camera unknown error at محطة شحن 2: Camera.take_photo() missing 1 required positional argument: 'component_id'
2025-11-13_02-11-37 | Connecting to udp://:14540 …
2025-11-13_02-11-38 | Connected.
2025-11-13_02-11-38 | Waiting for local_position_ok…
2025-11-13_12-29-40 | Connecting to udp://:14540 …
2025-11-13_12-29-41 | Connected.
2025-11-13_12-29-41 | Waiting for local_position_ok…
2025-11-13_13-04-50 | Connected
2025-11-13_13-04-50 | Arming…
2025-11-13_13-04-51 | Takeoff…
2025-11-13_13-11-04 | Connecting to udp://:14540 …
2025-11-13_13-11-05 | Connected.
2025-11-13_13-11-05 | Waiting for local_position_ok…
2025-11-13_13-14-57 | Connecting to udp://:14540 …
2025-11-13_13-14-57 | Connected.
2025-11-13_13-14-57 | Waiting for local_position_ok…
2025-11-13_13-14-58 | Local position OK.
2025-11-13_13-14-58 | Arming…
2025-11-13_13-14-58 | Offboard started, climbing…
2025-11-13_13-15-03 | Target لمبة 1: rel N=155.0, E=207.0
2025-11-13_13-15-03 | → Fly to لمبة 1-cruise: N=155.0, E=207.0, D=-35.0, yaw=53.2
2025-11-13_13-15-26 | Reached لمبة 1-cruise
2025-11-13_13-15-26 | → Fly to لمبة 1-cap: N=155.0, E=207.0, D=-15.0, yaw=53.2
2025-11-13_13-15-26 | Reached لمبة 1-cap
2025-11-13_13-15-26 | Holding 15s…
2025-11-13_13-15-41 | Camera error لمبة 1
2025-11-13_13-15-41 | → Fly to لمبة 1-back: N=155.0, E=207.0, D=-35.0, yaw=53.2
2025-11-13_13-15-41 | Reached لمبة 1-back
2025-11-13_13-15-41 | Target لمبة 2: rel N=105.9, E=19.7
2025-11-13_13-15-41 | → Fly to لمبة 2-cruise: N=105.9, E=19.7, D=-35.0, yaw=255.3
2025-11-13_13-15-59 | Reached لمبة 2-cruise
2025-11-13_13-15-59 | → Fly to لمبة 2-cap: N=105.9, E=19.7, D=-15.0, yaw=255.3
2025-11-13_13-15-59 | Reached لمبة 2-cap
2025-11-13_13-15-59 | Holding 15s…
2025-11-13_13-16-14 | Camera error لمبة 2
2025-11-13_13-16-14 | → Fly to لمبة 2-back: N=105.9, E=19.7, D=-35.0, yaw=255.3
2025-11-13_13-16-14 | Reached لمبة 2-back
2025-11-13_13-16-14 | Target لمبة 3: rel N=104.5, E=5.3
2025-11-13_13-16-14 | → Fly to لمبة 3-cruise: N=104.5, E=5.3, D=-35.0, yaw=264.5
2025-11-13_13-16-17 | Reached لمبة 3-cruise
2025-11-13_13-16-17 | → Fly to لمبة 3-cap: N=104.5, E=5.3, D=-15.0, yaw=264.5
2025-11-13_13-16-17 | Reached لمبة 3-cap
2025-11-13_13-16-17 | Holding 15s…
2025-11-13_13-16-32 | Camera error لمبة 3
2025-11-13_13-16-32 | → Fly to لمبة 3-back: N=104.5, E=5.3, D=-35.0, yaw=264.5
2025-11-13_13-16-32 | Reached لمبة 3-back
2025-11-13_13-16-32 | Target لمبة 4: rel N=122.4, E=18.8
2025-11-13_13-16-32 | → Fly to لمبة 4-cruise: N=122.4, E=18.8, D=-35.0, yaw=36.9
2025-11-13_13-16-35 | Reached لمبة 4-cruise
2025-11-13_13-16-35 | → Fly to لمبة 4-cap: N=122.4, E=18.8, D=-15.0, yaw=36.9
2025-11-13_13-16-35 | Reached لمبة 4-cap
2025-11-13_13-16-35 | Holding 15s…
2025-11-13_13-16-50 | Camera error لمبة 4
2025-11-13_13-16-50 | → Fly to لمبة 4-back: N=122.4, E=18.8, D=-35.0, yaw=36.9
2025-11-13_13-16-50 | Reached لمبة 4-back
2025-11-13_13-16-50 | Target لمبة 5: rel N=-141.1, E=525.0
2025-11-13_13-16-50 | → Fly to لمبة 5-cruise: N=-141.1, E=525.0, D=-35.0, yaw=117.5
2025-11-13_13-17-40 | Reached لمبة 5-cruise
2025-11-13_13-17-40 | → Fly to لمبة 5-cap: N=-141.1, E=525.0, D=-15.0, yaw=117.5
2025-11-13_13-17-40 | Reached لمبة 5-cap
2025-11-13_13-17-40 | Holding 15s…
2025-11-13_13-17-55 | Camera error لمبة 5
2025-11-13_13-17-55 | → Fly to لمبة 5-back: N=-141.1, E=525.0, D=-35.0, yaw=117.5
2025-11-13_13-17-55 | Reached لمبة 5-back
2025-11-13_13-17-55 | Target لمبة 6: rel N=-132.5, E=411.4
2025-11-13_13-17-55 | → Fly to لمبة 6-cruise: N=-132.5, E=411.4, D=-35.0, yaw=274.3
2025-11-13_13-18-06 | Reached لمبة 6-cruise
2025-11-13_13-18-06 | → Fly to لمبة 6-cap: N=-132.5, E=411.4, D=-15.0, yaw=274.3
2025-11-13_13-18-06 | Reached لمبة 6-cap
2025-11-13_13-18-06 | Holding 15s…
2025-11-13_13-18-21 | Camera error لمبة 6
2025-11-13_13-18-21 | → Fly to لمبة 6-back: N=-132.5, E=411.4, D=-35.0, yaw=274.3
2025-11-13_13-18-21 | Reached لمبة 6-back
2025-11-13_13-18-21 | Target لمبة 7: rel N=-129.3, E=349.8
2025-11-13_13-18-21 | → Fly to لمبة 7-cruise: N=-129.3, E=349.8, D=-35.0, yaw=273.0
2025-11-13_13-18-27 | Reached لمبة 7-cruise
2025-11-13_13-18-27 | → Fly to لمبة 7-cap: N=-129.3, E=349.8, D=-15.0, yaw=273.0
2025-11-13_13-18-27 | Reached لمبة 7-cap
2025-11-13_13-18-27 | Holding 15s…
2025-11-13_13-18-42 | Camera error لمبة 7
2025-11-13_13-18-42 | → Fly to لمبة 7-back: N=-129.3, E=349.8, D=-35.0, yaw=273.0
2025-11-13_13-18-42 | Reached لمبة 7-back
2025-11-13_13-18-42 | Target لمبة 8: rel N=-138.7, E=288.6
2025-11-13_13-18-42 | → Fly to لمبة 8-cruise: N=-138.7, E=288.6, D=-35.0, yaw=261.2
2025-11-13_13-18-49 | Reached لمبة 8-cruise
2025-11-13_13-18-49 | → Fly to لمبة 8-cap: N=-138.7, E=288.6, D=-15.0, yaw=261.2
2025-11-13_13-18-49 | Reached لمبة 8-cap
2025-11-13_13-18-49 | Holding 15s…
2025-11-13_13-19-04 | Camera error لمبة 8
2025-11-13_13-19-04 | → Fly to لمبة 8-back: N=-138.7, E=288.6, D=-35.0, yaw=261.2
2025-11-13_13-19-04 | Reached لمبة 8-back
2025-11-13_13-19-04 | Target محطة شحن 1: rel N=155.0, E=207.0
2025-11-13_13-19-04 | → Fly to محطة شحن 1-cruise: N=155.0, E=207.0, D=-35.0, yaw=344.5
2025-11-13_13-19-31 | Reached محطة شحن 1-cruise
2025-11-13_13-19-31 | → Fly to محطة شحن 1-cap: N=155.0, E=207.0, D=-15.0, yaw=344.5
2025-11-13_13-19-31 | Reached محطة شحن 1-cap
2025-11-13_13-19-31 | Holding 15s…
2025-11-13_13-19-46 | Camera error محطة شحن 1
2025-11-13_13-19-46 | → Fly to محطة شحن 1-back: N=155.0, E=207.0, D=-35.0, yaw=344.5
2025-11-13_13-19-46 | Reached محطة شحن 1-back
2025-11-13_13-19-46 | Target محطة شحن 2: rel N=99.5, E=-132.2
2025-11-13_13-19-46 | → Fly to محطة شحن 2-cruise: N=99.5, E=-132.2, D=-35.0, yaw=260.7
2025-11-13_13-20-17 | Reached محطة شحن 2-cruise
2025-11-13_13-20-17 | → Fly to محطة شحن 2-cap: N=99.5, E=-132.2, D=-15.0, yaw=260.7
2025-11-13_13-20-17 | Reached محطة شحن 2-cap
2025-11-13_13-20-17 | Holding 15s…
2025-11-13_13-20-32 | Camera error محطة شحن 2
2025-11-13_13-20-32 | → Fly to محطة شحن 2-back: N=99.5, E=-132.2, D=-35.0, yaw=260.7
2025-11-13_13-20-32 | Reached محطة شحن 2-back
2025-11-13_13-20-32 | Target محطة شحن 3: rel N=111.6, E=-108.3
2025-11-13_13-20-32 | → Fly to محطة شحن 3-cruise: N=111.6, E=-108.3, D=-35.0, yaw=63.2
2025-11-13_13-20-35 | Reached محطة شحن 3-cruise
2025-11-13_13-20-35 | → Fly to محطة شحن 3-cap: N=111.6, E=-108.3, D=-15.0, yaw=63.2
2025-11-13_13-20-35 | Reached محطة شحن 3-cap
2025-11-13_13-20-35 | Holding 15s…
2025-11-13_13-20-50 | Camera error محطة شحن 3
2025-11-13_13-20-50 | → Fly to محطة شحن 3-back: N=111.6, E=-108.3, D=-35.0, yaw=63.2
2025-11-13_13-20-50 | Reached محطة شحن 3-back
2025-11-13_13-20-50 | Target محطة شحن 4: rel N=89.9, E=-96.8
2025-11-13_13-20-50 | → Fly to محطة شحن 4-cruise: N=89.9, E=-96.8, D=-35.0, yaw=152.2
2025-11-13_13-20-54 | Reached محطة شحن 4-cruise
2025-11-13_13-20-54 | → Fly to محطة شحن 4-cap: N=89.9, E=-96.8, D=-15.0, yaw=152.2
2025-11-13_13-20-54 | Reached محطة شحن 4-cap
2025-11-13_13-20-54 | Holding 15s…
2025-11-13_13-21-09 | Camera error محطة شحن 4
2025-11-13_13-21-09 | → Fly to محطة شحن 4-back: N=89.9, E=-96.8, D=-35.0, yaw=152.2
2025-11-13_13-21-09 | Reached محطة شحن 4-back
2025-11-13_13-21-09 | Target اللوح 1: rel N=203.8, E=-50.9
2025-11-13_13-21-09 | → Fly to اللوح 1-cruise: N=203.8, E=-50.9, D=-35.0, yaw=22.0
2025-11-13_13-21-21 | Reached اللوح 1-cruise
2025-11-13_13-21-21 | → Fly to اللوح 1-cap: N=203.8, E=-50.9, D=-15.0, yaw=22.0
2025-11-13_13-21-21 | Reached اللوح 1-cap
2025-11-13_13-21-21 | Holding 15s…
2025-11-13_13-21-36 | Camera error اللوح 1
2025-11-13_13-21-36 | → Fly to اللوح 1-back: N=203.8, E=-50.9, D=-35.0, yaw=22.0
2025-11-13_13-21-36 | Reached اللوح 1-back
2025-11-13_13-21-36 | Target اللوح 2: rel N=201.2, E=-47.2
2025-11-13_13-21-36 | → Fly to اللوح 2-cruise: N=201.2, E=-47.2, D=-35.0, yaw=124.7
2025-11-13_13-21-36 | Reached اللوح 2-cruise
2025-11-13_13-21-36 | → Fly to اللوح 2-cap: N=201.2, E=-47.2, D=-15.0, yaw=124.7
2025-11-13_13-21-36 | Reached اللوح 2-cap
2025-11-13_13-21-36 | Holding 15s…
2025-11-13_13-21-51 | Camera error اللوح 2
2025-11-13_13-21-51 | → Fly to اللوح 2-back: N=201.2, E=-47.2, D=-35.0, yaw=124.7
2025-11-13_13-21-51 | Reached اللوح 2-back
2025-11-13_13-21-51 | Target اللوح 3: rel N=205.6, E=-43.2
2025-11-13_13-21-51 | → Fly to اللوح 3-cruise: N=205.6, E=-43.2, D=-35.0, yaw=42.3
2025-11-13_13-21-52 | Reached اللوح 3-cruise
2025-11-13_13-21-52 | → Fly to اللوح 3-cap: N=205.6, E=-43.2, D=-15.0, yaw=42.3
2025-11-13_13-21-52 | Reached اللوح 3-cap
2025-11-13_13-21-52 | Holding 15s…
2025-11-13_13-22-07 | Camera error اللوح 3
2025-11-13_13-22-07 | → Fly to اللوح 3-back: N=205.6, E=-43.2, D=-35.0, yaw=42.3
2025-11-13_13-22-07 | Reached اللوح 3-back
2025-11-13_13-22-07 | Target اللوح 4: rel N=203.1, E=-39.3
2025-11-13_13-22-07 | → Fly to اللوح 4-cruise: N=203.1, E=-39.3, D=-35.0, yaw=122.2
2025-11-13_13-22-07 | Reached اللوح 4-cruise
2025-11-13_13-22-07 | → Fly to اللوح 4-cap: N=203.1, E=-39.3, D=-15.0, yaw=122.2
2025-11-13_13-22-07 | Reached اللوح 4-cap
2025-11-13_13-22-07 | Holding 15s…
2025-11-13_13-22-22 | Camera error اللوح 4
2025-11-13_13-22-22 | → Fly to اللوح 4-back: N=203.1, E=-39.3, D=-35.0, yaw=122.2
2025-11-13_13-22-22 | Reached اللوح 4-back
2025-11-13_13-22-22 | Target اللوح 5: rel N=197.8, E=-52.0
2025-11-13_13-22-22 | → Fly to اللوح 5-cruise: N=197.8, E=-52.0, D=-35.0, yaw=247.0
2025-11-13_13-22-24 | Reached اللوح 5-cruise
2025-11-13_13-22-24 | → Fly to اللوح 5-cap: N=197.8, E=-52.0, D=-15.0, yaw=247.0
2025-11-13_13-22-24 | Reached اللوح 5-cap
2025-11-13_13-22-24 | Holding 15s…
2025-11-13_13-22-39 | Camera error اللوح 5
2025-11-13_13-22-39 | → Fly to اللوح 5-back: N=197.8, E=-52.0, D=-35.0, yaw=247.0
2025-11-13_13-22-39 | Reached اللوح 5-back
2025-11-13_13-22-39 | → Fly to HOME: N=0.0, E=0.0, D=-35.0, yaw=165.3
2025-11-13_13-22-58 | Reached HOME
2025-11-13_13-22-58 | 
— MISSION SUMMARY :: DRONE_1
  • Total places visited : 17
  • Photos captured      : 0
  • Types breakdown      : lamp=8, charger=4, panel=5
    - [FLAG=False] لمبة 1 (lamp) @ N=155.0m, E=207.0m 
    - [FLAG=False] لمبة 2 (lamp) @ N=105.9m, E=19.7m 
    - [FLAG=False] لمبة 3 (lamp) @ N=104.5m, E=5.3m 
    - [FLAG=False] لمبة 4 (lamp) @ N=122.4m, E=18.8m 
    - [FLAG=False] لمبة 5 (lamp) @ N=-141.1m, E=525.0m 
    - [FLAG=False] لمبة 6 (lamp) @ N=-132.5m, E=411.4m 
    - [FLAG=False] لمبة 7 (lamp) @ N=-129.3m, E=349.8m 
    - [FLAG=False] لمبة 8 (lamp) @ N=-138.7m, E=288.6m 
    - [FLAG=False] محطة شحن 1 (charger) @ N=155.0m, E=207.0m 
    - [FLAG=False] محطة شحن 2 (charger) @ N=99.5m, E=-132.2m 
    - [FLAG=False] محطة شحن 3 (charger) @ N=111.6m, E=-108.3m 
    - [FLAG=False] محطة شحن 4 (charger) @ N=89.9m, E=-96.8m 
    - [FLAG=False] اللوح 1 (panel) @ N=203.8m, E=-50.9m 
    - [FLAG=False] اللوح 2 (panel) @ N=201.2m, E=-47.2m 
    - [FLAG=False] اللوح 3 (panel) @ N=205.6m, E=-43.2m 
    - [FLAG=False] اللوح 4 (panel) @ N=203.1m, E=-39.3m 
    - [FLAG=False] اللوح 5 (panel) @ N=197.8m, E=-52.0m 
2025-11-13_14-19-11 | Connecting to udp://:14540 …
2025-11-13_14-19-12 | Connected.
2025-11-13_14-19-12 | Waiting for local_position_ok…
2025-11-13_14-19-12 | Local position OK.
2025-11-13_14-19-12 | Arming…
2025-11-13_14-19-12 | Offboard started, climbing…
2025-11-13_14-19-17 | Target لمبة 1: rel N=155.0, E=207.0
2025-11-13_14-19-17 | → Fly to لمبة 1-cruise: N=155.0, E=207.0, D=-35.0, yaw=53.2
2025-11-13_14-19-40 | Reached لمبة 1-cruise
2025-11-13_14-19-40 | → Fly to لمبة 1-cap: N=155.0, E=207.0, D=-15.0, yaw=53.2
2025-11-13_14-19-40 | Reached لمبة 1-cap
2025-11-13_14-19-40 | Holding 15s…
2025-11-13_14-19-56 | Camera error لمبة 1
2025-11-13_14-19-56 | → Fly to لمبة 1-back: N=155.0, E=207.0, D=-35.0, yaw=53.2
2025-11-13_14-19-56 | Reached لمبة 1-back
2025-11-13_14-19-56 | Target لمبة 2: rel N=105.9, E=19.7
2025-11-13_14-19-56 | → Fly to لمبة 2-cruise: N=105.9, E=19.7, D=-35.0, yaw=255.3
2025-11-13_14-20-13 | Reached لمبة 2-cruise
2025-11-13_14-20-13 | → Fly to لمبة 2-cap: N=105.9, E=19.7, D=-15.0, yaw=255.3
2025-11-13_14-20-13 | Reached لمبة 2-cap
2025-11-13_14-20-13 | Holding 15s…
2025-11-13_14-20-28 | Camera error لمبة 2
2025-11-13_14-20-28 | → Fly to لمبة 2-back: N=105.9, E=19.7, D=-35.0, yaw=255.3
2025-11-13_14-20-28 | Reached لمبة 2-back
2025-11-13_14-20-28 | Target لمبة 3: rel N=104.5, E=5.3
2025-11-13_14-20-28 | → Fly to لمبة 3-cruise: N=104.5, E=5.3, D=-35.0, yaw=264.5
2025-11-13_14-20-31 | Reached لمبة 3-cruise
2025-11-13_14-20-31 | → Fly to لمبة 3-cap: N=104.5, E=5.3, D=-15.0, yaw=264.5
2025-11-13_14-20-31 | Reached لمبة 3-cap
2025-11-13_14-20-31 | Holding 15s…
2025-11-13_14-20-46 | Camera error لمبة 3
2025-11-13_14-20-46 | → Fly to لمبة 3-back: N=104.5, E=5.3, D=-35.0, yaw=264.5
2025-11-13_14-20-46 | Reached لمبة 3-back
2025-11-13_14-20-46 | Target لمبة 4: rel N=122.4, E=18.8
2025-11-13_14-20-46 | → Fly to لمبة 4-cruise: N=122.4, E=18.8, D=-35.0, yaw=36.9
2025-11-13_14-20-49 | Reached لمبة 4-cruise
2025-11-13_14-20-49 | → Fly to لمبة 4-cap: N=122.4, E=18.8, D=-15.0, yaw=36.9
2025-11-13_14-20-49 | Reached لمبة 4-cap
2025-11-13_14-20-49 | Holding 15s…
2025-11-13_14-21-04 | Camera error لمبة 4
2025-11-13_14-21-04 | → Fly to لمبة 4-back: N=122.4, E=18.8, D=-35.0, yaw=36.9
2025-11-13_14-21-04 | Reached لمبة 4-back
2025-11-13_14-21-04 | Target لمبة 5: rel N=-141.1, E=525.0
2025-11-13_14-21-04 | → Fly to لمبة 5-cruise: N=-141.1, E=525.0, D=-35.0, yaw=117.5
2025-11-13_14-21-54 | Reached لمبة 5-cruise
2025-11-13_14-21-54 | → Fly to لمبة 5-cap: N=-141.1, E=525.0, D=-15.0, yaw=117.5
2025-11-13_14-21-54 | Reached لمبة 5-cap
2025-11-13_14-21-54 | Holding 15s…
2025-11-13_14-22-09 | Camera error لمبة 5
2025-11-13_14-22-09 | → Fly to لمبة 5-back: N=-141.1, E=525.0, D=-35.0, yaw=117.5
2025-11-13_14-22-09 | Reached لمبة 5-back
2025-11-13_14-22-09 | Target لمبة 6: rel N=-132.5, E=411.4
2025-11-13_14-22-09 | → Fly to لمبة 6-cruise: N=-132.5, E=411.4, D=-35.0, yaw=274.3
2025-11-13_14-22-20 | Reached لمبة 6-cruise
2025-11-13_14-22-20 | → Fly to لمبة 6-cap: N=-132.5, E=411.4, D=-15.0, yaw=274.3
2025-11-13_14-22-20 | Reached لمبة 6-cap
2025-11-13_14-22-20 | Holding 15s…
2025-11-13_14-22-35 | Camera error لمبة 6
2025-11-13_14-22-35 | → Fly to لمبة 6-back: N=-132.5, E=411.4, D=-35.0, yaw=274.3
2025-11-13_14-22-35 | Reached لمبة 6-back
2025-11-13_14-22-35 | Target لمبة 7: rel N=-129.3, E=349.8
2025-11-13_14-22-35 | → Fly to لمبة 7-cruise: N=-129.3, E=349.8, D=-35.0, yaw=273.0
2025-11-13_14-22-42 | Reached لمبة 7-cruise
2025-11-13_14-22-42 | → Fly to لمبة 7-cap: N=-129.3, E=349.8, D=-15.0, yaw=273.0
2025-11-13_14-22-42 | Reached لمبة 7-cap
2025-11-13_14-22-42 | Holding 15s…
2025-11-13_14-22-57 | Camera error لمبة 7
2025-11-13_14-22-57 | → Fly to لمبة 7-back: N=-129.3, E=349.8, D=-35.0, yaw=273.0
2025-11-13_14-22-57 | Reached لمبة 7-back
2025-11-13_14-22-57 | Target لمبة 8: rel N=-138.7, E=288.6
2025-11-13_14-22-57 | → Fly to لمبة 8-cruise: N=-138.7, E=288.6, D=-35.0, yaw=261.2
2025-11-13_14-23-03 | Reached لمبة 8-cruise
2025-11-13_14-23-03 | → Fly to لمبة 8-cap: N=-138.7, E=288.6, D=-15.0, yaw=261.2
2025-11-13_14-23-03 | Reached لمبة 8-cap
2025-11-13_14-23-03 | Holding 15s…
2025-11-13_14-23-18 | Camera error لمبة 8
2025-11-13_14-23-18 | → Fly to لمبة 8-back: N=-138.7, E=288.6, D=-35.0, yaw=261.2
2025-11-13_14-23-18 | Reached لمبة 8-back
2025-11-13_14-23-18 | Target محطة شحن 1: rel N=155.0, E=207.0
2025-11-13_14-23-18 | → Fly to محطة شحن 1-cruise: N=155.0, E=207.0, D=-35.0, yaw=344.5
2025-11-13_14-23-45 | Reached محطة شحن 1-cruise
2025-11-13_14-23-45 | → Fly to محطة شحن 1-cap: N=155.0, E=207.0, D=-15.0, yaw=344.5
2025-11-13_14-23-45 | Reached محطة شحن 1-cap
2025-11-13_14-23-45 | Holding 15s…
2025-11-13_14-24-00 | Camera error محطة شحن 1
2025-11-13_14-24-00 | → Fly to محطة شحن 1-back: N=155.0, E=207.0, D=-35.0, yaw=344.5
2025-11-13_14-24-00 | Reached محطة شحن 1-back
2025-11-13_14-24-00 | Target محطة شحن 2: rel N=99.5, E=-132.2
2025-11-13_14-24-00 | → Fly to محطة شحن 2-cruise: N=99.5, E=-132.2, D=-35.0, yaw=260.7
2025-11-13_14-24-31 | Reached محطة شحن 2-cruise
2025-11-13_14-24-31 | → Fly to محطة شحن 2-cap: N=99.5, E=-132.2, D=-15.0, yaw=260.7
2025-11-13_14-24-31 | Reached محطة شحن 2-cap
2025-11-13_14-24-31 | Holding 15s…
2025-11-13_14-24-46 | Camera error محطة شحن 2
2025-11-13_14-24-46 | → Fly to محطة شحن 2-back: N=99.5, E=-132.2, D=-35.0, yaw=260.7
2025-11-13_14-24-46 | Reached محطة شحن 2-back
2025-11-13_14-24-46 | Target محطة شحن 3: rel N=111.6, E=-108.3
2025-11-13_14-24-46 | → Fly to محطة شحن 3-cruise: N=111.6, E=-108.3, D=-35.0, yaw=63.2
2025-11-13_14-24-50 | Reached محطة شحن 3-cruise
2025-11-13_14-24-50 | → Fly to محطة شحن 3-cap: N=111.6, E=-108.3, D=-15.0, yaw=63.2
2025-11-13_14-24-50 | Reached محطة شحن 3-cap
2025-11-13_14-24-50 | Holding 15s…
2025-11-13_14-25-05 | Camera error محطة شحن 3
2025-11-13_14-25-05 | → Fly to محطة شحن 3-back: N=111.6, E=-108.3, D=-35.0, yaw=63.2
2025-11-13_14-25-05 | Reached محطة شحن 3-back
2025-11-13_14-25-05 | Target محطة شحن 4: rel N=89.9, E=-96.8
2025-11-13_14-25-05 | → Fly to محطة شحن 4-cruise: N=89.9, E=-96.8, D=-35.0, yaw=152.2
2025-11-13_14-25-08 | Reached محطة شحن 4-cruise
2025-11-13_14-25-08 | → Fly to محطة شحن 4-cap: N=89.9, E=-96.8, D=-15.0, yaw=152.2
2025-11-13_14-25-08 | Reached محطة شحن 4-cap
2025-11-13_14-25-08 | Holding 15s…
2025-11-13_14-25-23 | Camera error محطة شحن 4
2025-11-13_14-25-23 | → Fly to محطة شحن 4-back: N=89.9, E=-96.8, D=-35.0, yaw=152.2
2025-11-13_14-25-23 | Reached محطة شحن 4-back
2025-11-13_14-25-23 | Target اللوح 1: rel N=203.8, E=-50.9
2025-11-13_14-25-23 | → Fly to اللوح 1-cruise: N=203.8, E=-50.9, D=-35.0, yaw=22.0
2025-11-13_14-25-35 | Reached اللوح 1-cruise
2025-11-13_14-25-35 | → Fly to اللوح 1-cap: N=203.8, E=-50.9, D=-15.0, yaw=22.0
2025-11-13_14-25-35 | Reached اللوح 1-cap
2025-11-13_14-25-35 | Holding 15s…
2025-11-13_14-25-50 | Camera error اللوح 1
2025-11-13_14-25-50 | → Fly to اللوح 1-back: N=203.8, E=-50.9, D=-35.0, yaw=22.0
2025-11-13_14-25-50 | Reached اللوح 1-back
2025-11-13_14-25-50 | Target اللوح 2: rel N=201.2, E=-47.2
2025-11-13_14-25-50 | → Fly to اللوح 2-cruise: N=201.2, E=-47.2, D=-35.0, yaw=124.7
2025-11-13_14-25-50 | Reached اللوح 2-cruise
2025-11-13_14-25-50 | → Fly to اللوح 2-cap: N=201.2, E=-47.2, D=-15.0, yaw=124.7
2025-11-13_14-25-50 | Reached اللوح 2-cap
2025-11-13_14-25-50 | Holding 15s…
2025-11-13_14-26-05 | Camera error اللوح 2
2025-11-13_14-26-05 | → Fly to اللوح 2-back: N=201.2, E=-47.2, D=-35.0, yaw=124.7
2025-11-13_14-26-05 | Reached اللوح 2-back
2025-11-13_14-26-05 | Target اللوح 3: rel N=205.6, E=-43.2
2025-11-13_14-26-05 | → Fly to اللوح 3-cruise: N=205.6, E=-43.2, D=-35.0, yaw=42.3
2025-11-13_14-26-06 | Reached اللوح 3-cruise
2025-11-13_14-26-06 | → Fly to اللوح 3-cap: N=205.6, E=-43.2, D=-15.0, yaw=42.3
2025-11-13_14-26-06 | Reached اللوح 3-cap
2025-11-13_14-26-06 | Holding 15s…
2025-11-13_14-26-21 | Camera error اللوح 3
2025-11-13_14-26-21 | → Fly to اللوح 3-back: N=205.6, E=-43.2, D=-35.0, yaw=42.3
2025-11-13_14-26-21 | Reached اللوح 3-back
2025-11-13_14-26-21 | Target اللوح 4: rel N=203.1, E=-39.3
2025-11-13_14-26-21 | → Fly to اللوح 4-cruise: N=203.1, E=-39.3, D=-35.0, yaw=122.2
2025-11-13_14-26-21 | Reached اللوح 4-cruise
2025-11-13_14-26-21 | → Fly to اللوح 4-cap: N=203.1, E=-39.3, D=-15.0, yaw=122.2
2025-11-13_14-26-21 | Reached اللوح 4-cap
2025-11-13_14-26-21 | Holding 15s…
2025-11-13_14-26-36 | Camera error اللوح 4
2025-11-13_14-26-36 | → Fly to اللوح 4-back: N=203.1, E=-39.3, D=-35.0, yaw=122.2
2025-11-13_14-26-36 | Reached اللوح 4-back
2025-11-13_14-26-36 | Target اللوح 5: rel N=197.8, E=-52.0
2025-11-13_14-26-36 | → Fly to اللوح 5-cruise: N=197.8, E=-52.0, D=-35.0, yaw=247.0
2025-11-13_14-26-38 | Reached اللوح 5-cruise
2025-11-13_14-26-38 | → Fly to اللوح 5-cap: N=197.8, E=-52.0, D=-15.0, yaw=247.0
2025-11-13_14-26-38 | Reached اللوح 5-cap
2025-11-13_14-26-38 | Holding 15s…
2025-11-13_14-26-53 | Camera error اللوح 5
2025-11-13_14-26-53 | → Fly to اللوح 5-back: N=197.8, E=-52.0, D=-35.0, yaw=247.0
2025-11-13_14-26-53 | Reached اللوح 5-back
2025-11-13_14-26-53 | → Fly to HOME: N=0.0, E=0.0, D=-35.0, yaw=165.3
2025-11-13_14-27-12 | Reached HOME
2025-11-13_14-27-12 | 
— MISSION SUMMARY :: DRONE_1
  • Total places visited : 17
  • Photos captured      : 0
  • Types breakdown      : lamp=8, charger=4, panel=5
    - [FLAG=False] لمبة 1 (lamp) @ N=155.0m, E=207.0m 
    - [FLAG=False] لمبة 2 (lamp) @ N=105.9m, E=19.7m 
    - [FLAG=False] لمبة 3 (lamp) @ N=104.5m, E=5.3m 
    - [FLAG=False] لمبة 4 (lamp) @ N=122.4m, E=18.8m 
    - [FLAG=False] لمبة 5 (lamp) @ N=-141.1m, E=525.0m 
    - [FLAG=False] لمبة 6 (lamp) @ N=-132.5m, E=411.4m 
    - [FLAG=False] لمبة 7 (lamp) @ N=-129.3m, E=349.8m 
    - [FLAG=False] لمبة 8 (lamp) @ N=-138.7m, E=288.6m 
    - [FLAG=False] محطة شحن 1 (charger) @ N=155.0m, E=207.0m 
    - [FLAG=False] محطة شحن 2 (charger) @ N=99.5m, E=-132.2m 
    - [FLAG=False] محطة شحن 3 (charger) @ N=111.6m, E=-108.3m 
    - [FLAG=False] محطة شحن 4 (charger) @ N=89.9m, E=-96.8m 
    - [FLAG=False] اللوح 1 (panel) @ N=203.8m, E=-50.9m 
    - [FLAG=False] اللوح 2 (panel) @ N=201.2m, E=-47.2m 
    - [FLAG=False] اللوح 3 (panel) @ N=205.6m, E=-43.2m 
    - [FLAG=False] اللوح 4 (panel) @ N=203.1m, E=-39.3m 
    - [FLAG=False] اللوح 5 (panel) @ N=197.8m, E=-52.0m 
2025-11-13_16-22-31 | Connecting to udp://:14540 …
2025-11-13_16-22-33 | Connected.
2025-11-13_16-22-33 | Waiting for local_position_ok…
2025-11-13_16-22-35 | Local position OK.
2025-11-13_16-22-35 | Arming…
2025-11-13_16-22-35 | Offboard started, climbing…
2025-11-13_16-22-40 | Target لمبة 1: rel N=155.0, E=207.0
2025-11-13_16-22-40 | → Fly to لمبة 1-cruise: N=155.0, E=207.0, D=-35.0, yaw=53.2
2025-11-13_16-23-43 | Reached لمبة 1-cruise
2025-11-13_16-23-43 | → Fly to لمبة 1-cap: N=155.0, E=207.0, D=-15.0, yaw=53.2
2025-11-13_16-23-43 | Reached لمبة 1-cap
2025-11-13_16-23-43 | Holding 15s…
2025-11-13_16-23-58 | Camera error لمبة 1
2025-11-13_16-23-58 | → Fly to لمبة 1-back: N=155.0, E=207.0, D=-35.0, yaw=53.2
2025-11-13_16-23-58 | Reached لمبة 1-back
2025-11-13_16-23-58 | Target لمبة 2: rel N=105.9, E=19.7
2025-11-13_16-23-58 | → Fly to لمبة 2-cruise: N=105.9, E=19.7, D=-35.0, yaw=255.3
2025-11-13_16-25-24 | Reached لمبة 2-cruise
2025-11-13_16-25-24 | → Fly to لمبة 2-cap: N=105.9, E=19.7, D=-15.0, yaw=255.3
2025-11-13_16-25-24 | Reached لمبة 2-cap
2025-11-13_16-25-24 | Holding 15s…
2025-11-13_16-25-39 | Camera error لمبة 2
2025-11-13_16-25-39 | → Fly to لمبة 2-back: N=105.9, E=19.7, D=-35.0, yaw=255.3
2025-11-13_16-25-39 | Reached لمبة 2-back
2025-11-13_16-25-39 | Target لمبة 3: rel N=104.5, E=5.3
2025-11-13_16-25-39 | → Fly to لمبة 3-cruise: N=104.5, E=5.3, D=-35.0, yaw=264.5
2025-11-13_16-29-39 | ⚠️ TIMEOUT لمبة 3-cruise
2025-11-13_16-29-39 | → Fly to لمبة 3-cap: N=104.5, E=5.3, D=-15.0, yaw=264.5
2025-11-13_16-33-39 | ⚠️ TIMEOUT لمبة 3-cap
2025-11-13_16-33-39 | Holding 15s…
2025-11-13_16-33-54 | Camera error لمبة 3
2025-11-13_16-33-54 | → Fly to لمبة 3-back: N=104.5, E=5.3, D=-35.0, yaw=264.5
2025-11-13_16-37-54 | ⚠️ TIMEOUT لمبة 3-back
2025-11-13_16-37-54 | Target لمبة 4: rel N=122.4, E=18.8
2025-11-13_16-37-54 | → Fly to لمبة 4-cruise: N=122.4, E=18.8, D=-35.0, yaw=36.9
